{
  "model_id": "nova-pro",
  "name": "Nova Pro",
  "organization_id": "amazon",
  "fine_tuned_from_model_id": null,
  "description": "Amazon Nova Pro is a highly-capable multimodal model with state-of-the-art performance across text, image, and video understanding. It excels at core capabilities like language understanding, mathematical reasoning, and multimodal tasks while offering industry-leading speed and cost efficiency.",
  "release_date": "2024-11-20",
  "announcement_date": "2024-11-20",
  "license_id": "proprietary",
  "multimodal": true,
  "knowledge_cutoff": null,
  "param_count": null,
  "training_tokens": null,
  "available_in_zeroeval": true,
  "source_api_ref": "https://docs.aws.amazon.com/bedrock/latest/userguide/model-parameters-nova.html",
  "source_playground": null,
  "source_paper": "https://www.amazon.science/publications/the-amazon-nova-family-of-models-technical-report-and-model-card",
  "source_scorecard_blog_link": null,
  "source_repo_link": "https://huggingface.co/amazon-agi",
  "source_weights_link": null,
  "created_at": "2025-07-19T19:49:05.431675+00:00",
  "updated_at": "2025-07-19T19:49:05.431675+00:00",
  "model_family_id": null
}