{
  "model_id": "o3-pro-2025-06-10",
  "name": "o3-pro",
  "organization_id": "openai",
  "fine_tuned_from_model_id": null,
  "description": "Version of o3 with more compute for better responses. The o3-pro model uses more compute to think harder and provide consistently better answers. Designed to tackle tough problems with advanced reasoning capabilities.",
  "release_date": "2025-06-10",
  "announcement_date": "2025-06-10",
  "license_id": "proprietary",
  "multimodal": true,
  "knowledge_cutoff": "2024-05-31",
  "param_count": null,
  "training_tokens": null,
  "available_in_zeroeval": true,
  "source_api_ref": "https://platform.openai.com/docs/models/o3-pro",
  "source_playground": null,
  "source_paper": null,
  "source_scorecard_blog_link": null,
  "source_repo_link": null,
  "source_weights_link": null,
  "created_at": "2025-07-19T19:49:05.832229+00:00",
  "updated_at": "2025-07-19T19:49:05.832229+00:00",
  "model_family_id": null
}