{
  "model_id": "grok-2-mini",
  "name": "Grok-2 mini",
  "organization_id": "xai",
  "fine_tuned_from_model_id": null,
  "description": "Grok-2 mini is a smaller, faster variant of Grok-2 that offers a balance between speed and answer quality. While more compact than its larger sibling, it maintains strong capabilities across various tasks including reasoning, coding, and chat interactions.",
  "release_date": "2024-08-13",
  "announcement_date": "2024-08-13",
  "license_id": "proprietary",
  "multimodal": true,
  "knowledge_cutoff": null,
  "param_count": null,
  "training_tokens": null,
  "available_in_zeroeval": true,
  "source_api_ref": "https://x.ai/api",
  "source_playground": null,
  "source_paper": null,
  "source_scorecard_blog_link": "https://x.ai/blog/grok-2",
  "source_repo_link": null,
  "source_weights_link": null,
  "created_at": "2025-07-19T19:49:05.702680+00:00",
  "updated_at": "2025-07-19T19:49:05.702680+00:00",
  "model_family_id": null
}