{
  "model_id": "claude-3-sonnet-20240229",
  "name": "Claude 3 Sonnet",
  "organization_id": "anthropic",
  "fine_tuned_from_model_id": null,
  "description": "Claude 3 Sonnet strikes the ideal balance between intelligence and speed\u2014particularly for enterprise workloads. It delivers strong performance at a lower cost compared to its peers, and is engineered for high endurance in large-scale AI deployments.",
  "release_date": "2024-02-29",
  "announcement_date": "2024-02-29",
  "license_id": "proprietary",
  "multimodal": true,
  "knowledge_cutoff": null,
  "param_count": null,
  "training_tokens": null,
  "available_in_zeroeval": true,
  "source_api_ref": "https://www.anthropic.com/claude",
  "source_playground": "https://claude.ai",
  "source_paper": "https://www-cdn.anthropic.com/de8ba9b01c9ab7cbabf5c33b80b7bbc618857627/Model_Card_Claude_3.pdf",
  "source_scorecard_blog_link": "https://www.anthropic.com/news/claude-3-family",
  "source_repo_link": null,
  "source_weights_link": null,
  "created_at": "2025-07-19T19:49:05.740647+00:00",
  "updated_at": "2025-07-19T19:49:05.740647+00:00",
  "model_family_id": null
}