{
  "model_id": "o1-mini",
  "name": "o1-mini",
  "organization_id": "openai",
  "fine_tuned_from_model_id": null,
  "description": "o1-mini is a cost-efficient language model developed by OpenAI, designed for advanced reasoning tasks while minimizing computational resources.",
  "release_date": "2024-09-12",
  "announcement_date": "2024-09-12",
  "license_id": "proprietary",
  "multimodal": false,
  "knowledge_cutoff": null,
  "param_count": null,
  "training_tokens": null,
  "available_in_zeroeval": true,
  "source_api_ref": "https://openai.com/api/o1-mini",
  "source_playground": "https://platform.openai.com/playground",
  "source_paper": "https://cdn.openai.com/o1-system-card-20240917.pdf",
  "source_scorecard_blog_link": "https://openai.com/index/openai-o1-mini-advancing-cost-efficient-reasoning/",
  "source_repo_link": null,
  "source_weights_link": null,
  "created_at": "2025-07-19T19:49:05.850010+00:00",
  "updated_at": "2025-07-19T19:49:05.850010+00:00",
  "model_family_id": null
}