{
  "model_id": "llama-3.1-nemotron-70b-instruct",
  "name": "Llama 3.1 Nemotron 70B Instruct",
  "organization_id": "nvidia",
  "fine_tuned_from_model_id": "llama-3.1-70b-instruct",
  "description": "A large language model customized by NVIDIA to improve the helpfulness of LLM generated responses. It is a fine-tuned version of Llama 3.1 70B Instruct. The model was trained using RLHF (REINFORCE) with HelpSteer2-Preference prompts.",
  "release_date": "2024-10-01",
  "announcement_date": "2024-10-01",
  "license_id": "llama_3_1_community_license",
  "multimodal": false,
  "knowledge_cutoff": "2023-12-01",
  "param_count": 70000000000,
  "training_tokens": null,
  "available_in_zeroeval": true,
  "source_api_ref": "https://build.nvidia.com/nvidia/llama-3_1-nemotron-70b-instruct",
  "source_playground": null,
  "source_paper": "https://arxiv.org/abs/2410.01257",
  "source_scorecard_blog_link": "https://developer.nvidia.com/blog/advancing-the-accuracy-efficiency-frontier-with-llama-3-1-nemotron-51b/",
  "source_repo_link": null,
  "source_weights_link": "https://huggingface.co/nvidia/Llama-3.1-Nemotron-70B-Instruct",
  "created_at": "2025-07-19T19:49:05.908923+00:00",
  "updated_at": "2025-07-19T19:49:05.908923+00:00",
  "model_family_id": null
}