{
  "model_id": "nova-lite",
  "name": "Nova Lite",
  "organization_id": "amazon",
  "fine_tuned_from_model_id": null,
  "description": "A low-cost multimodal model that is lightning fast for processing images, video, documents, and text.",
  "release_date": "2024-11-20",
  "announcement_date": "2024-11-20",
  "license_id": "proprietary",
  "multimodal": true,
  "knowledge_cutoff": null,
  "param_count": null,
  "training_tokens": null,
  "available_in_zeroeval": true,
  "source_api_ref": "https://aws.amazon.com/bedrock/amazon-nova-lite",
  "source_playground": null,
  "source_paper": "https://www.amazon.science/publications/the-amazon-nova-family-of-models-technical-report-and-model-card",
  "source_scorecard_blog_link": null,
  "source_repo_link": null,
  "source_weights_link": null,
  "created_at": "2025-07-19T19:49:05.429271+00:00",
  "updated_at": "2025-07-19T19:49:05.429271+00:00",
  "model_family_id": null
}