{
  "model_id": "claude-3-7-sonnet-20250219",
  "name": "Claude 3.7 Sonnet",
  "organization_id": "anthropic",
  "fine_tuned_from_model_id": null,
  "description": "The most intelligent Claude model and the first hybrid reasoning model on the market. Claude 3.7 Sonnet can produce near-instant responses or extended, step-by-step thinking that is made visible to the user. Shows particularly strong improvements in coding and front-end web development.",
  "release_date": "2025-02-24",
  "announcement_date": "2025-02-24",
  "license_id": "proprietary",
  "multimodal": true,
  "knowledge_cutoff": null,
  "param_count": null,
  "training_tokens": null,
  "available_in_zeroeval": true,
  "source_api_ref": "https://docs.anthropic.com/en/docs/about-claude/models/all-models",
  "source_playground": "https://claude.ai",
  "source_paper": null,
  "source_scorecard_blog_link": "https://www.anthropic.com/news/claude-3-7-sonnet",
  "source_repo_link": null,
  "source_weights_link": null,
  "created_at": "2025-07-19T19:49:05.747775+00:00",
  "updated_at": "2025-07-19T19:49:05.747775+00:00",
  "model_family_id": null
}