{
  "model_id": "codestral-22b",
  "name": "Codestral-22B",
  "organization_id": "mistral",
  "fine_tuned_from_model_id": null,
  "description": "A 22B parameter code generation model trained on 80+ programming languages including Python, Java, C, C++, JavaScript, and Bash. Supports both instruction-following and fill-in-the-middle (FIM) capabilities for code completion and generation tasks.",
  "release_date": "2024-05-29",
  "announcement_date": "2024-05-29",
  "license_id": "mnpl_0_1",
  "multimodal": false,
  "knowledge_cutoff": null,
  "param_count": 22200000000,
  "training_tokens": null,
  "available_in_zeroeval": true,
  "source_api_ref": "https://docs.mistral.ai/api/",
  "source_playground": "https://chat.mistral.ai/",
  "source_paper": null,
  "source_scorecard_blog_link": "https://mistral.ai/news/codestral/",
  "source_repo_link": null,
  "source_weights_link": "https://huggingface.co/mistralai/Codestral-22B-v0.1",
  "created_at": "2025-07-19T19:49:05.805621+00:00",
  "updated_at": "2025-07-19T19:49:05.805621+00:00",
  "model_family_id": null
}