{
  "model_id": "gemini-2.0-flash",
  "name": "Gemini 2.0 Flash",
  "organization_id": "google",
  "fine_tuned_from_model_id": null,
  "description": "Next-generation model featuring superior speed, native tool use, multimodal generation, and a 1M token context window. Supports audio, images, video, and text input with capabilities for structured outputs, function calling, code execution, search, and multimodal operations.",
  "release_date": "2024-12-01",
  "announcement_date": "2024-12-01",
  "license_id": "proprietary",
  "multimodal": true,
  "knowledge_cutoff": "2024-08-01",
  "param_count": null,
  "training_tokens": null,
  "available_in_zeroeval": true,
  "source_api_ref": "https://ai.google.dev/gemini-api/docs/models/gemini#gemini-2.0-flash",
  "source_playground": "https://ai.google.dev/studio",
  "source_paper": null,
  "source_scorecard_blog_link": "https://blog.google/technology/google-deepmind/google-gemini-ai-update-december-2024/",
  "source_repo_link": null,
  "source_weights_link": null,
  "created_at": "2025-07-19T19:49:05.538624+00:00",
  "updated_at": "2025-07-19T19:49:05.538624+00:00",
  "model_family_id": null
}