{
  "model_id": "o1-pro",
  "name": "o1-pro",
  "organization_id": "openai",
  "fine_tuned_from_model_id": null,
  "description": "o1-pro is OpenAI's advanced language model optimized for complex reasoning and specialized professional tasks, offering enhanced capabilities while maintaining high efficiency.",
  "release_date": "2024-12-17",
  "announcement_date": "2024-12-17",
  "license_id": "proprietary",
  "multimodal": true,
  "knowledge_cutoff": "2023-09-30",
  "param_count": null,
  "training_tokens": null,
  "available_in_zeroeval": true,
  "source_api_ref": "https://openai.com/api",
  "source_playground": "https://platform.openai.com/playground",
  "source_paper": "https://cdn.openai.com/o1-system-card-20240917.pdf",
  "source_scorecard_blog_link": "https://openai.com/index/introducing-chatgpt-pro/",
  "source_repo_link": null,
  "source_weights_link": null,
  "created_at": "2025-07-19T19:49:05.844613+00:00",
  "updated_at": "2025-07-19T19:49:05.844613+00:00",
  "model_family_id": null
}