{
  "model_id": "magistral-medium",
  "name": "Magistral Medium",
  "organization_id": "mistral",
  "fine_tuned_from_model_id": null,
  "description": "Trained solely with reinforcement learning on top of Mistral Medium 3, Magistral Medium is a reasoning model that achieves strong performance on complex math and code tasks without relying on distillation from existing reasoning models. The training uses an RLVR framework with modifications to GRPO, enabling improved reasoning ability and multilingual consistency.",
  "release_date": "2025-06-10",
  "announcement_date": "2025-06-10",
  "license_id": "apache_2_0",
  "multimodal": true,
  "knowledge_cutoff": "2025-06-01",
  "param_count": 24000000000,
  "training_tokens": null,
  "available_in_zeroeval": true,
  "source_api_ref": "https://docs.mistral.ai/api/",
  "source_playground": "https://chat.mistral.ai/",
  "source_paper": "https://arxiv.org/pdf/2506.10910",
  "source_scorecard_blog_link": "https://mistral.ai/news/magistral",
  "source_repo_link": null,
  "source_weights_link": null,
  "created_at": "2025-07-19T19:49:05.780565+00:00",
  "updated_at": "2025-07-19T19:49:05.780565+00:00",
  "model_family_id": null
}