{
  "model_id": "gemma-2-9b-it",
  "name": "Gemma 2 9B",
  "organization_id": "google",
  "fine_tuned_from_model_id": null,
  "description": "Gemma 2 9B IT is an instruction-tuned version of Google's Gemma 2 9B base model. It was trained on 8 trillion tokens of web data, code, and math content. The model features sliding window attention, logit soft-capping, and knowledge distillation techniques. It's optimized for dialogue applications through supervised fine-tuning, distillation, RLHF, and model merging using WARP.",
  "release_date": "2024-06-27",
  "announcement_date": "2024-06-27",
  "license_id": "gemma",
  "multimodal": false,
  "knowledge_cutoff": null,
  "param_count": 9240000000,
  "training_tokens": 8000000000000,
  "available_in_zeroeval": true,
  "source_api_ref": "https://huggingface.co/google/gemma-2-9b-it",
  "source_playground": "https://huggingface.co/chat/models/google/gemma-2-9b-it",
  "source_paper": "https://storage.googleapis.com/deepmind-media/gemma/gemma-2-report.pdf",
  "source_scorecard_blog_link": "https://huggingface.co/blog/gemma2",
  "source_repo_link": null,
  "source_weights_link": "https://huggingface.co/google/gemma-2-9b-it",
  "created_at": "2025-07-19T19:49:05.477806+00:00",
  "updated_at": "2025-07-19T19:49:05.477806+00:00",
  "model_family_id": null
}