{
  "model_id": "qwen3-32b",
  "name": "Qwen3 32B",
  "organization_id": "qwen",
  "fine_tuned_from_model_id": null,
  "description": "Qwen3-32B is a large language model from Alibaba's Qwen3 series. It features 32.8 billion parameters, a 128k token context window, support for 119 languages, and hybrid thinking modes allowing switching between deep reasoning and fast responses. It demonstrates strong performance in reasoning, instruction-following, and agent capabilities.",
  "release_date": "2025-04-29",
  "announcement_date": "2025-04-29",
  "license_id": "apache_2_0",
  "multimodal": false,
  "knowledge_cutoff": null,
  "param_count": 32800000000,
  "training_tokens": null,
  "available_in_zeroeval": true,
  "source_api_ref": null,
  "source_playground": "https://chat.qwen.ai/",
  "source_paper": null,
  "source_scorecard_blog_link": "https://qwenlm.github.io/blog/qwen3/",
  "source_repo_link": "https://github.com/QwenLM/Qwen3",
  "source_weights_link": "https://huggingface.co/Qwen/Qwen3-32B",
  "created_at": "2025-07-19T19:49:05.621845+00:00",
  "updated_at": "2025-07-19T19:49:05.621845+00:00",
  "model_family_id": null
}