{
  "model_id": "mistral-small-2409",
  "name": "Mistral Small",
  "organization_id": "mistral",
  "fine_tuned_from_model_id": null,
  "description": "An enterprise-grade 22B parameter model optimized for tasks like translation, summarization, and sentiment analysis. Offers significant improvements in human alignment, reasoning capabilities, and code generation compared to previous versions.",
  "release_date": "2024-09-17",
  "announcement_date": "2024-09-17",
  "license_id": "mistral_research_license",
  "multimodal": false,
  "knowledge_cutoff": null,
  "param_count": 22000000000,
  "training_tokens": null,
  "available_in_zeroeval": true,
  "source_api_ref": "https://docs.mistral.ai/api/",
  "source_playground": "https://console.mistral.ai/",
  "source_paper": null,
  "source_scorecard_blog_link": "https://mistral.ai/news/september-24-release/",
  "source_repo_link": null,
  "source_weights_link": "https://huggingface.co/mistralai/Mistral-Small-Instruct-2409",
  "created_at": "2025-07-19T19:49:05.809465+00:00",
  "updated_at": "2025-07-19T19:49:05.809465+00:00",
  "model_family_id": null
}