{
  "model_id": "grok-2",
  "name": "Grok-2",
  "organization_id": "xai",
  "fine_tuned_from_model_id": null,
  "description": "Grok-2 is a frontier language model with state-of-the-art reasoning capabilities, featuring advanced abilities in chat, coding, and reasoning. It demonstrates superior performance in visual math reasoning, document-based question answering, and excels across various academic benchmarks including reasoning, reading comprehension, math, and science.",
  "release_date": "2024-08-13",
  "announcement_date": "2024-08-13",
  "license_id": "proprietary",
  "multimodal": true,
  "knowledge_cutoff": null,
  "param_count": null,
  "training_tokens": null,
  "available_in_zeroeval": true,
  "source_api_ref": "https://x.ai/api",
  "source_playground": null,
  "source_paper": null,
  "source_scorecard_blog_link": "https://x.ai/blog/grok-2",
  "source_repo_link": null,
  "source_weights_link": null,
  "created_at": "2025-07-19T19:49:05.715016+00:00",
  "updated_at": "2025-07-19T19:49:05.715016+00:00",
  "model_family_id": null
}