{
  "model_id": "deepseek-r1-0528",
  "name": "DeepSeek-R1-0528",
  "organization_id": "deepseek",
  "fine_tuned_from_model_id": "deepseek-v3",
  "description": "An upgraded version of DeepSeek R1 with significantly improved reasoning capabilities. This model leverages increased computational resources and algorithmic optimization mechanisms during post-training, demonstrating outstanding performance across mathematics, programming, and general logic tasks.",
  "release_date": "2025-05-28",
  "announcement_date": "2025-05-28",
  "license_id": "mit_license",
  "multimodal": false,
  "knowledge_cutoff": null,
  "param_count": 671000000000,
  "training_tokens": 14800000000000,
  "available_in_zeroeval": true,
  "source_api_ref": "https://api-docs.deepseek.com/news/news250120",
  "source_playground": "https://chat.deepseek.com",
  "source_paper": "https://arxiv.org/abs/2501.12948",
  "source_scorecard_blog_link": null,
  "source_repo_link": "https://github.com/deepseek-ai/DeepSeek-R1",
  "source_weights_link": "https://huggingface.co/deepseek-ai/DeepSeek-R1-0528",
  "created_at": "2025-07-19T19:49:05.899107+00:00",
  "updated_at": "2025-07-19T19:49:05.899107+00:00",
  "model_family_id": null
}